{
  "run": {
    "schema": "kndo-v2/m6",
    "mode": "full",
    "files_discovered": 3,
    "files_claimed": 2,
    "extensions": [
      {
        "id": "kndo:js-ts",
        "files": 2
      }
    ]
  },
  "health": {
    "implicated": 0,
    "subjects": 3,
    "by_category": [],
    "by_package": [
      {
        "name": "jsx-component-tree",
        "manifest": "package.json",
        "implicated": 0,
        "subjects": 3
      }
    ]
  },
  "findings": [],
  "fixed": [],
  "baselined": 0,
  "abstained": [
    {
      "category": "test-only",
      "reason": "no-test-roots-anywhere",
      "scope": "whole-run"
    },
    {
      "category": "untested",
      "reason": "no-test-roots-anywhere",
      "scope": "whole-run"
    }
  ],
  "suppressed": {
    "total": 0,
    "by_category": []
  },
  "plugins": [
    {
      "coordinate": "kndo:coverage-lcov",
      "roots": 0,
      "findings": 0,
      "dropped": [],
      "content_budget_cut": false
    }
  ],
  "diagnostics": []
}