{
  "run": {
    "schema": "kndo-v2/m6",
    "mode": "full",
    "files_discovered": 4,
    "files_claimed": 3,
    "extensions": [
      {
        "id": "kndo:python",
        "files": 3,
        "export_narrowing": "none",
        "import_cycles": "hazard",
        "dependency_scoping": "scoped",
        "dependency_identity": "underivable"
      }
    ]
  },
  "health": {
    "implicated": 0,
    "subjects": 8,
    "by_category": [],
    "by_package": [
      {
        "name": "",
        "manifest": "",
        "implicated": 0,
        "subjects": 8
      }
    ]
  },
  "findings": [
    {
      "id": "kndo-a5d012befb86",
      "category": "crap",
      "severity": "info",
      "confidence": "probable",
      "subject": {
        "kind": "symbol",
        "path": "src/classify.py",
        "selector": {
          "Free": "classify"
        },
        "span": {
          "start": 0,
          "end": 399
        }
      },
      "lines": {
        "start": 1,
        "end": 16
      },
      "message": "complexity 10 with 13% of its lines executed by tests scores 75 on the CRAP scale, at or above 30"
    },
    {
      "id": "kndo-e45bd8de813e",
      "category": "untested",
      "severity": "info",
      "confidence": "certain",
      "subject": {
        "kind": "symbol",
        "path": "src/dark.py",
        "selector": {
          "Free": "never_run"
        },
        "span": {
          "start": 0,
          "end": 63
        }
      },
      "lines": {
        "start": 1,
        "end": 4
      },
      "message": "no test executes this function"
    }
  ],
  "fixed": [],
  "baselined": 0,
  "abstained": [],
  "suppressed": {
    "total": 0,
    "by_category": []
  },
  "plugins": [
    {
      "coordinate": "kndo:coverage-lcov",
      "roots": 0,
      "findings": 0,
      "dropped": [],
      "content_budget_cut": false
    }
  ],
  "diagnostics": []
}