{
  "run": {
    "schema": "kndo-v2/m6",
    "mode": "full",
    "files_discovered": 4,
    "files_claimed": 2,
    "extensions": [
      {
        "id": "kndo:js-ts",
        "files": 2,
        "unread": {
          "files": 0,
          "names": 0
        },
        "import_cycles": "hazard",
        "dependency_scoping": "scoped",
        "dependency_identity": "package-name",
        "ladder": [
          {
            "rung": "file",
            "word": "unexported",
            "bearer": "free"
          },
          {
            "rung": "exported",
            "word": "export"
          }
        ]
      }
    ]
  },
  "health": {
    "implicated": 0,
    "subjects": 5,
    "by_category": [],
    "by_package": [
      {
        "name": "coverage-demo",
        "manifest": "package.json",
        "implicated": 0,
        "subjects": 5
      }
    ]
  },
  "findings": [
    {
      "id": "kndo-f5eea7905f5d",
      "category": "untested",
      "severity": "info",
      "confidence": "certain",
      "subject": {
        "kind": "symbol",
        "path": "src/calc.js",
        "selector": {
          "name": "neverRan"
        },
        "span": {
          "start": 199,
          "end": 273
        }
      },
      "lines": {
        "start": 15,
        "end": 20
      },
      "message": "no test executes this function"
    }
  ],
  "fixed": [],
  "baselined": 0,
  "abstained": [],
  "suppressed": {
    "total": 0,
    "by_category": []
  },
  "plugins": [
    {
      "coordinate": "kndo:coverage-lcov",
      "roots": 0,
      "findings": 0,
      "dropped": [],
      "content_budget_cut": false
    },
    {
      "coordinate": "kndo:coverage-cobertura",
      "roots": 0,
      "findings": 0,
      "dropped": [],
      "content_budget_cut": false
    },
    {
      "coordinate": "kndo:coverage-jacoco",
      "roots": 0,
      "findings": 0,
      "dropped": [],
      "content_budget_cut": false
    },
    {
      "coordinate": "kndo:coverage-go",
      "roots": 0,
      "findings": 0,
      "dropped": [],
      "content_budget_cut": false
    }
  ],
  "diagnostics": []
}