{
  "run": {
    "schema": "kndo-v2/m6",
    "mode": "full",
    "files_discovered": 4,
    "files_claimed": 3,
    "extensions": [
      {
        "id": "kndo:rust",
        "files": 3
      }
    ]
  },
  "health": {
    "implicated": 0,
    "subjects": 6,
    "by_category": []
  },
  "findings": [],
  "fixed": [],
  "baselined": 0,
  "abstained": [],
  "suppressed": {
    "total": 0,
    "by_category": []
  },
  "plugins": [
    {
      "coordinate": "kndo:coverage-lcov",
      "roots": 0,
      "findings": 0,
      "dropped": [],
      "content_budget_cut": false
    }
  ],
  "diagnostics": []
}