{
  "run": {
    "schema": "kndo-v2/m6",
    "files_discovered": 3,
    "files_claimed": 2,
    "extensions": [
      {
        "id": "kndo:java",
        "files": 2
      }
    ]
  },
  "health": {
    "implicated": 0,
    "subjects": 13,
    "by_category": []
  },
  "findings": [
    {
      "id": "kndo-6691d4853264",
      "category": "internal-only",
      "severity": "info",
      "confidence": "probable",
      "subject": {
        "kind": "symbol",
        "path": "src/main/java/com/foo/Widget.java",
        "selector": {
          "Member": {
            "owner": "Inner",
            "name": "helper"
          }
        },
        "span": {
          "start": 938,
          "end": 954
        }
      },
      "message": "declared `package`-scoped, but every use is within its own file — the narrower rung would suffice for this function"
    },
    {
      "id": "kndo-7a31c9765221",
      "category": "internal-only",
      "severity": "info",
      "confidence": "probable",
      "subject": {
        "kind": "symbol",
        "path": "src/main/java/com/foo/Widget.java",
        "selector": {
          "Member": {
            "owner": "Widget",
            "name": "Inner"
          }
        },
        "span": {
          "start": 863,
          "end": 960
        }
      },
      "message": "declared `package`-scoped, but every use is within its own file — the narrower rung would suffice for this type"
    },
    {
      "id": "kndo-b475845d7cf3",
      "category": "internal-only",
      "severity": "info",
      "confidence": "probable",
      "subject": {
        "kind": "symbol",
        "path": "src/main/java/com/foo/Widget.java",
        "selector": {
          "Member": {
            "owner": "Inner",
            "name": "go"
          }
        },
        "span": {
          "start": 885,
          "end": 928
        }
      },
      "message": "declared `package`-scoped, but every use is within its own file — the narrower rung would suffice for this function"
    }
  ],
  "fixed": [],
  "baselined": 0,
  "abstained": [
    {
      "category": "test-only",
      "reason": "no-test-roots-anywhere",
      "scope": "whole-run"
    },
    {
      "category": "untested",
      "reason": "no-test-roots-anywhere",
      "scope": "whole-run"
    }
  ],
  "suppressed": {
    "total": 0,
    "by_category": []
  },
  "plugins": [
    {
      "coordinate": "kndo:coverage-lcov",
      "roots": 0,
      "findings": 0,
      "dropped": [],
      "content_budget_cut": false
    }
  ],
  "diagnostics": []
}