{
  "run": {
    "schema": "kndo-v2/m6",
    "mode": "full",
    "files_discovered": 4,
    "files_claimed": 3,
    "extensions": [
      {
        "id": "kndo:go",
        "files": 3,
        "export_narrowing": "none",
        "import_cycles": "tolerated",
        "dependency_scoping": "unscoped",
        "dependency_identity": "module-path"
      }
    ]
  },
  "health": {
    "implicated": 1,
    "subjects": 7,
    "by_category": [
      {
        "category": "unused",
        "findings": 1
      }
    ],
    "by_package": [
      {
        "name": "example.com/demo",
        "manifest": "go.mod",
        "implicated": 1,
        "subjects": 7
      }
    ]
  },
  "findings": [
    {
      "id": "kndo-99e57ae7061e",
      "category": "unused",
      "severity": "warning",
      "confidence": "certain",
      "subject": {
        "kind": "symbol",
        "path": "sub/format.go",
        "selector": {
          "Free": "deadHelper"
        },
        "span": {
          "start": 151,
          "end": 194
        }
      },
      "lines": {
        "start": 8,
        "end": 10
      },
      "message": "nothing references, roots, or imports this declaration"
    }
  ],
  "fixed": [],
  "baselined": 0,
  "abstained": [
    {
      "category": "test-only",
      "reason": "no-test-roots-anywhere",
      "scope": "whole-run"
    },
    {
      "category": "untested",
      "reason": "no-test-roots-anywhere",
      "scope": "whole-run"
    }
  ],
  "suppressed": {
    "total": 0,
    "by_category": []
  },
  "plugins": [
    {
      "coordinate": "kndo:coverage-lcov",
      "roots": 0,
      "findings": 0,
      "dropped": [],
      "content_budget_cut": false
    }
  ],
  "diagnostics": []
}