{
  "run": {
    "schema": "kndo-v2/m6",
    "mode": "full",
    "files_discovered": 5,
    "files_claimed": 4,
    "extensions": [
      {
        "id": "kndo:js-ts",
        "files": 4
      }
    ]
  },
  "health": {
    "implicated": 3,
    "subjects": 8,
    "by_category": [
      {
        "category": "unused",
        "findings": 3
      }
    ],
    "by_package": [
      {
        "name": "dynamic-import-scan",
        "manifest": "package.json",
        "implicated": 3,
        "subjects": 8
      }
    ]
  },
  "findings": [
    {
      "id": "kndo-7ade39fd74d5",
      "category": "unused",
      "severity": "warning",
      "confidence": "certain",
      "subject": {
        "kind": "file",
        "path": "src/handlers/alpha.ts"
      },
      "message": "no root anchors this file and no reachable file imports it"
    },
    {
      "id": "kndo-a2c5bae20559",
      "category": "unused",
      "severity": "warning",
      "confidence": "certain",
      "subject": {
        "kind": "file",
        "path": "src/handlers/beta.ts"
      },
      "message": "no root anchors this file and no reachable file imports it"
    },
    {
      "id": "kndo-8ebdc5c36690",
      "category": "unused",
      "severity": "warning",
      "confidence": "certain",
      "subject": {
        "kind": "file",
        "path": "src/outside/dead.ts"
      },
      "message": "no root anchors this file and no reachable file imports it"
    }
  ],
  "fixed": [],
  "baselined": 0,
  "abstained": [
    {
      "category": "test-only",
      "reason": "no-test-roots-anywhere",
      "scope": "whole-run"
    },
    {
      "category": "untested",
      "reason": "no-test-roots-anywhere",
      "scope": "whole-run"
    }
  ],
  "suppressed": {
    "total": 0,
    "by_category": []
  },
  "plugins": [
    {
      "coordinate": "kndo:coverage-lcov",
      "roots": 0,
      "findings": 0,
      "dropped": [],
      "content_budget_cut": false
    }
  ],
  "diagnostics": []
}