{
  "run": {
    "schema": "kndo-v2/m6",
    "mode": "full",
    "files_discovered": 3,
    "files_claimed": 2,
    "extensions": [
      {
        "id": "kndo:rust",
        "files": 2,
        "narrowable_scopes": [
          "crate"
        ],
        "export_narrowing": "none",
        "import_cycles": "tolerated"
      }
    ]
  },
  "health": {
    "implicated": 0,
    "subjects": 10,
    "by_category": [],
    "by_package": [
      {
        "name": "cfgimpl",
        "manifest": "Cargo.toml",
        "implicated": 0,
        "subjects": 10
      }
    ]
  },
  "findings": [],
  "fixed": [],
  "baselined": 0,
  "abstained": [],
  "suppressed": {
    "total": 0,
    "by_category": []
  },
  "plugins": [
    {
      "coordinate": "kndo:coverage-lcov",
      "roots": 0,
      "findings": 0,
      "dropped": [],
      "content_budget_cut": false
    }
  ],
  "diagnostics": []
}