{
  "run": {
    "schema": "kndo-v2/m6",
    "mode": "full",
    "files_discovered": 6,
    "files_claimed": 4,
    "extensions": [
      {
        "id": "kndo:rust",
        "files": 4
      }
    ]
  },
  "health": {
    "implicated": 0,
    "subjects": 8,
    "by_category": []
  },
  "findings": [
    {
      "id": "kndo-7b30f73a06ad",
      "category": "untested",
      "severity": "info",
      "confidence": "probable",
      "subject": {
        "kind": "file",
        "path": "src/work.rs"
      },
      "message": "production-reachable, but no test reaches this file"
    }
  ],
  "fixed": [],
  "baselined": 0,
  "abstained": [],
  "suppressed": {
    "total": 0,
    "by_category": []
  },
  "plugins": [
    {
      "coordinate": "kndo:coverage-lcov",
      "roots": 0,
      "findings": 0,
      "dropped": [],
      "content_budget_cut": false
    }
  ],
  "diagnostics": []
}