{
  "run": {
    "schema": "kndo-v2/m6",
    "files_discovered": 2,
    "files_claimed": 1,
    "extensions": [
      {
        "id": "kndo:kotlin",
        "files": 1
      }
    ]
  },
  "health": {
    "implicated": 0,
    "subjects": 10,
    "by_category": []
  },
  "findings": [
    {
      "id": "kndo-0e79a122618f",
      "category": "internal-only",
      "severity": "info",
      "confidence": "probable",
      "subject": {
        "kind": "symbol",
        "path": "src/main/kotlin/demo/Demo.kt",
        "selector": {
          "Free": "MyProvider"
        },
        "span": {
          "start": 243,
          "end": 280
        }
      },
      "message": "declared `module`-scoped, but every use is within its own file — the narrower rung would suffice for this type"
    },
    {
      "id": "kndo-564989475f65",
      "category": "internal-only",
      "severity": "info",
      "confidence": "probable",
      "subject": {
        "kind": "symbol",
        "path": "src/main/kotlin/demo/Demo.kt",
        "selector": {
          "Free": "MyMeta"
        },
        "span": {
          "start": 282,
          "end": 322
        }
      },
      "message": "declared `module`-scoped, but every use is within its own file — the narrower rung would suffice for this type"
    }
  ],
  "fixed": [],
  "baselined": 0,
  "abstained": [
    {
      "category": "test-only",
      "reason": "no-test-roots-anywhere",
      "scope": "whole-run"
    },
    {
      "category": "untested",
      "reason": "no-test-roots-anywhere",
      "scope": "whole-run"
    }
  ],
  "suppressed": {
    "total": 0,
    "by_category": []
  },
  "plugins": [
    {
      "coordinate": "kndo:coverage-lcov",
      "roots": 0,
      "findings": 0,
      "dropped": [],
      "content_budget_cut": false
    }
  ],
  "diagnostics": []
}