{
  "run": {
    "schema": "kndo-v2/m6",
    "mode": "full",
    "files_discovered": 4,
    "files_claimed": 3,
    "extensions": [
      {
        "id": "kndo:rust",
        "files": 3,
        "narrowable_scopes": [
          "crate"
        ],
        "export_narrowing": "none",
        "import_cycles": "tolerated",
        "dependency_scoping": "scoped",
        "dependency_identity": "crate-root"
      }
    ]
  },
  "health": {
    "implicated": 0,
    "subjects": 11,
    "by_category": [],
    "by_package": [
      {
        "name": "tryunwrap",
        "manifest": "Cargo.toml",
        "implicated": 0,
        "subjects": 11
      }
    ]
  },
  "findings": [],
  "fixed": [],
  "baselined": 0,
  "abstained": [
    {
      "category": "test-only",
      "reason": "no-test-roots-anywhere",
      "scope": "whole-run"
    },
    {
      "category": "untested",
      "reason": "no-test-roots-anywhere",
      "scope": "whole-run"
    }
  ],
  "suppressed": {
    "total": 0,
    "by_category": []
  },
  "plugins": [
    {
      "coordinate": "kndo:coverage-lcov",
      "roots": 0,
      "findings": 0,
      "dropped": [],
      "content_budget_cut": false
    }
  ],
  "diagnostics": []
}