{
  "run": {
    "schema": "kndo-v2/m6",
    "mode": "full",
    "files_discovered": 5,
    "files_claimed": 4,
    "extensions": [
      {
        "id": "kndo:js-ts",
        "files": 4
      }
    ]
  },
  "health": {
    "implicated": 0,
    "subjects": 7,
    "by_category": []
  },
  "findings": [
    {
      "id": "kndo-dffd185d7dd0",
      "category": "test-only",
      "severity": "info",
      "confidence": "probable",
      "subject": {
        "kind": "file",
        "path": "src/fixtures.ts"
      },
      "message": "only tests reach this file — no production or tooling root does"
    }
  ],
  "fixed": [],
  "baselined": 0,
  "abstained": [],
  "suppressed": {
    "total": 0,
    "by_category": []
  },
  "plugins": [
    {
      "coordinate": "kndo:coverage-lcov",
      "roots": 0,
      "findings": 0,
      "dropped": [],
      "content_budget_cut": false
    }
  ],
  "diagnostics": []
}