{
  "run": {
    "schema": "kndo-v2/m6",
    "mode": "full",
    "files_discovered": 3,
    "files_claimed": 2,
    "extensions": [
      {
        "id": "kndo:go",
        "files": 2,
        "export_narrowing": "none",
        "import_cycles": "tolerated",
        "dependency_scoping": "unscoped",
        "dependency_identity": "module-path"
      }
    ]
  },
  "health": {
    "implicated": 0,
    "subjects": 4,
    "by_category": [],
    "by_package": [
      {
        "name": "example.com/app",
        "manifest": "go.mod",
        "implicated": 0,
        "subjects": 4
      }
    ]
  },
  "findings": [],
  "fixed": [],
  "baselined": 0,
  "abstained": [
    {
      "category": "test-only",
      "reason": "no-test-roots-anywhere",
      "scope": "whole-run"
    },
    {
      "category": "untested",
      "reason": "no-test-roots-anywhere",
      "scope": "whole-run"
    }
  ],
  "suppressed": {
    "total": 0,
    "by_category": []
  },
  "plugins": [
    {
      "coordinate": "kndo:coverage-lcov",
      "roots": 0,
      "findings": 0,
      "dropped": [],
      "content_budget_cut": false
    }
  ],
  "diagnostics": []
}