{
  "run": {
    "schema": "kndo-v2/m6",
    "files_discovered": 3,
    "files_claimed": 3,
    "extensions": [
      {
        "id": "kndo:python",
        "files": 3
      }
    ]
  },
  "health": {
    "implicated": 1,
    "subjects": 7,
    "by_category": [
      {
        "category": "unused",
        "findings": 1
      }
    ]
  },
  "findings": [
    {
      "id": "kndo-87d16de20247",
      "category": "unused",
      "severity": "warning",
      "confidence": "certain",
      "subject": {
        "kind": "symbol",
        "path": "src/pkg/impl.py",
        "selector": {
          "Free": "_stranded"
        },
        "span": {
          "start": 60,
          "end": 89
        }
      },
      "message": "nothing references, roots, or imports this declaration"
    }
  ],
  "fixed": [],
  "baselined": 0,
  "abstained": [
    {
      "category": "test-only",
      "reason": "no-test-roots-anywhere",
      "scope": "whole-run"
    },
    {
      "category": "untested",
      "reason": "no-test-roots-anywhere",
      "scope": "whole-run"
    }
  ],
  "suppressed": {
    "total": 0,
    "by_category": []
  },
  "plugins": [
    {
      "coordinate": "kndo:coverage-lcov",
      "roots": 0,
      "findings": 0,
      "dropped": [],
      "content_budget_cut": false
    }
  ],
  "diagnostics": []
}