{
  "run": {
    "schema": "kndo-v2/m6",
    "mode": "full",
    "files_discovered": 3,
    "files_claimed": 2,
    "extensions": [
      {
        "id": "kndo:js-ts",
        "files": 2,
        "export_narrowing": "expressible",
        "import_cycles": "hazard",
        "dependency_scoping": "scoped",
        "dependency_identity": "path-prefix"
      }
    ]
  },
  "health": {
    "implicated": 0,
    "subjects": 3,
    "by_category": [],
    "by_package": [
      {
        "name": "dependency-hygiene",
        "manifest": "package.json",
        "implicated": 0,
        "subjects": 3
      }
    ]
  },
  "findings": [
    {
      "id": "kndo-e5d2262395b9",
      "category": "test-only",
      "severity": "info",
      "confidence": "probable",
      "subject": {
        "kind": "dependency",
        "owner_manifest": "package.json",
        "name": "chai"
      },
      "message": "declared as a production dependency, but only test files import it — a test-scope declaration would suffice"
    }
  ],
  "fixed": [],
  "baselined": 0,
  "abstained": [],
  "suppressed": {
    "total": 0,
    "by_category": []
  },
  "plugins": [
    {
      "coordinate": "kndo:coverage-lcov",
      "roots": 0,
      "findings": 0,
      "dropped": [],
      "content_budget_cut": false
    }
  ],
  "diagnostics": []
}