{
  "run": {
    "schema": "kndo-v2/m6",
    "mode": "full",
    "files_discovered": 2,
    "files_claimed": 1,
    "extensions": [
      {
        "id": "kndo:js-ts",
        "files": 1,
        "export_narrowing": "expressible",
        "import_cycles": "hazard",
        "dependency_scoping": "scoped",
        "dependency_identity": "package-name"
      }
    ]
  },
  "health": {
    "implicated": 1,
    "subjects": 4,
    "by_category": [
      {
        "category": "unused",
        "findings": 1
      }
    ],
    "by_package": [
      {
        "name": "library-public-api",
        "manifest": "package.json",
        "implicated": 1,
        "subjects": 4
      }
    ]
  },
  "findings": [
    {
      "id": "kndo-e6deb88fe2cd",
      "category": "unused",
      "severity": "warning",
      "confidence": "certain",
      "subject": {
        "kind": "symbol",
        "path": "src/index.ts",
        "selector": {
          "Free": "unusedHelper"
        },
        "span": {
          "start": 350,
          "end": 468
        }
      },
      "lines": {
        "start": 12,
        "end": 14
      },
      "message": "nothing references, roots, or imports this declaration"
    }
  ],
  "fixed": [],
  "baselined": 0,
  "abstained": [
    {
      "category": "test-only",
      "reason": "no-test-roots-anywhere",
      "scope": "whole-run"
    },
    {
      "category": "untested",
      "reason": "no-test-roots-anywhere",
      "scope": "whole-run"
    }
  ],
  "suppressed": {
    "total": 0,
    "by_category": []
  },
  "plugins": [
    {
      "coordinate": "kndo:coverage-lcov",
      "roots": 0,
      "findings": 0,
      "dropped": [],
      "content_budget_cut": false
    }
  ],
  "diagnostics": []
}